experiments/evaluation_results.json

{
  "v1_doc_level_ret_eval": {
    "git_commit": "3f699a557caedfca3a270c34123d2c6dd9505aa3",
    "retrieval": {
      "recall_at_10": 0.4667,
      "precision_at_10": 0.07,
      "mrr": 0.2661,
      "hit_rate_at_10": 0.7,
      "latency_s": 0.1746,
      "peak_memory_mb": 5695.5355
    },
    "generation": {
      "sentence_integrity_rate": 0.9775,
      "latency_s": 65.2054,
      "input_tokens_count": 1156.7,
      "output_tokens_count": 110.8,
      "peak_memory_mb": 6374.5848
    },
    "overall": {
      "latency_s": 65.419,
      "peak_memory_mb": 6461.1953
    }
  },
  "v2_chunk_level_ret_eval": {
    "git_commit": "",
    "retrieval": {
      "recall_at_10": 0.4083,
      "precision_at_10": 0.1,
      "mrr": 0.525,
      "hit_rate_at_10": 0.6,
      "latency_s": 1.788,
      "peak_memory_mb": 5647.5844
    },
    "generation": {
      "faithfulness": 0.0,
      "answer_completeness": 0.0,
      "hallucination_rate": 0.98,
      "sentence_integrity_rate": 0.9172,
      "latency_s": 139.9393,
      "input_tokens_count": 1220.5,
      "output_tokens_count": 143.1,
      "peak_memory_mb": 6198.7617
    },
    "overall": {
      "latency_s": 215.6182,
      "peak_memory_mb": 6332.7188
    }
  },
  "sparse_both": {
    "git_commit": "79374cd5887001d1d8a27cd17f6cd893d85a3338",
    "retrieval": {
      "recall_at_k": 0.4194,
      "precision_at_k": 0.1,
      "mrr": 0.4722,
      "hit_rate_at_k": 0.6,
      "latency_s": 0.1921,
      "peak_memory_mb": 6054.9538
    },
    "generation": {
      "faithfulness": 0.0,
      "answer_completeness": 0.0,
      "hallucination_rate": 0.9333,
      "sentence_integrity": 0.8697,
      "latency_s": 30.4387,
      "input_tokens_count": 1210.5,
      "output_tokens_count": 90.77,
      "peak_memory_mb": 6359.8648
    },
    "overall": {
      "latency_s": 56.6194,
      "peak_memory_mb": 6504.3711
    }
  },
  "dense_both_base": {
    "git_commit": "346da986ff805d393d817b5b9a7ff5f36e6abcb7",
    "retrieval": {
      "recall_at_k": 0.2417,
      "precision_at_k": 0.03,
      "mrr": 0.3006,
      "hit_rate_at_k": 0.4333,
      "latency_s": 0.0587,
      "peak_memory_mb": 6726.2017
    },
    "generation": {
      "faithfulness": 0.0,
      "answer_completeness": 0.0,
      "hallucination_rate": 1.0,
      "sentence_integrity": 0.9498,
      "latency_s": 62.4098,
      "ttft_s": 27.8585,
      "tpot_ms": 191.7815,
      "input_tokens_count": 2330.17,
      "output_tokens_count": 180.5,
      "peak_memory_mb": 6726.2017
    },
    "overall": {
      "latency_s": 102.1599,
      "peak_memory_mb": 6993.39
    }
  },
  "sparse_ret_no_rerank": {
    "git_commit": "c26128a83c8a6c5be2a784a605a7f117e182e881",
    "query_count": 30,
    "retrieval": {
      "recall_at_k": 0.4972,
      "precision_at_k": 0.0583,
      "mrr": 0.4743,
      "hit_rate_at_k": 0.6333,
      "latency_s": 0.1056,
      "peak_memory_mb": 503.521
    },
    "generation": {
      "latency_s": null,
      "ttft_s": null,
      "tpot_ms": null,
      "input_tokens_count": null,
      "output_tokens_count": null,
      "peak_memory_mb": null
    },
    "overall": {
      "latency_s": 0.1076,
      "peak_memory_mb": 503.57
    }
  },
  "dense_ret_no_rerannk": {
    "git_commit": "c26128a83c8a6c5be2a784a605a7f117e182e881",
    "query_count": 30,
    "retrieval": {
      "recall_at_k": 0.2417,
      "precision_at_k": 0.03,
      "mrr": 0.3006,
      "hit_rate_at_k": 0.4333,
      "latency_s": 0.0145,
      "peak_memory_mb": 546.3757
    },
    "generation": {
      "latency_s": null,
      "ttft_s": null,
      "tpot_ms": null,
      "input_tokens_count": null,
      "output_tokens_count": null,
      "peak_memory_mb": null
    },
    "overall": {
      "latency_s": 0.017,
      "peak_memory_mb": 548.44
    }
  },
  "hybrid_ret_no_rerank": {
    "git_commit": "c26128a83c8a6c5be2a784a605a7f117e182e881",
    "query_count": 30,
    "retrieval": {
      "recall_at_k": 0.4694,
      "precision_at_k": 0.055,
      "mrr": 0.4128,
      "hit_rate_at_k": 0.6333,
      "latency_s": 0.1205,
      "peak_memory_mb": 695.02
    },
    "generation": {
      "latency_s": null,
      "ttft_s": null,
      "tpot_ms": null,
      "input_tokens_count": null,
      "output_tokens_count": null,
      "peak_memory_mb": null
    },
    "overall": {
      "latency_s": 0.1226,
      "peak_memory_mb": 697.72
    }
  },
  "sparse_ret_rerank": {
    "git_commit": "c26128a83c8a6c5be2a784a605a7f117e182e881",
    "query_count": 30,
    "retrieval": {
      "recall_at_k": 0.4194,
      "precision_at_k": 0.0483,
      "mrr": 0.4452,
      "hit_rate_at_k": 0.6333,
      "latency_s": 4.7858,
      "peak_memory_mb": 1803.527
    },
    "generation": {
      "latency_s": null,
      "ttft_s": null,
      "tpot_ms": null,
      "input_tokens_count": null,
      "output_tokens_count": null,
      "peak_memory_mb": null
    },
    "overall": {
      "latency_s": 4.79,
      "peak_memory_mb": 2767.99
    }
  },
  "dense_ret_rerank": {
    "git_commit": "c26128a83c8a6c5be2a784a605a7f117e182e881",
    "query_count": 30,
    "retrieval": {
      "recall_at_k": 0.3861,
      "precision_at_k": 0.045,
      "mrr": 0.4439,
      "hit_rate_at_k": 0.5667,
      "latency_s": 9.3922,
      "peak_memory_mb": 1810.5477
    },
    "generation": {
      "latency_s": null,
      "ttft_s": null,
      "tpot_ms": null,
      "input_tokens_count": null,
      "output_tokens_count": null,
      "peak_memory_mb": null
    },
    "overall": {
      "latency_s": 9.3988,
      "peak_memory_mb": 2563.34
    }
  },
  "hybrid_ret_rerank": {
    "git_commit": "c26128a83c8a6c5be2a784a605a7f117e182e881",
    "query_count": 30,
    "retrieval": {
      "recall_at_k": 0.3861,
      "precision_at_k": 0.045,
      "mrr": 0.4364,
      "hit_rate_at_k": 0.6,
      "latency_s": 9.3433,
      "peak_memory_mb": 1902.6843
    },
    "generation": {
      "latency_s": null,
      "ttft_s": null,
      "tpot_ms": null,
      "input_tokens_count": null,
      "output_tokens_count": null,
      "peak_memory_mb": null
    },
    "overall": {
      "latency_s": 9.3481,
      "peak_memory_mb": 2715.59
    }
  },
  "hybrid_upd_ret_no_rerank": {
    "git_commit": "b55a62f3b7e3f733a7e71d992e11e850956ea365",
    "query_count": 30,
    "retrieval": {
      "recall_at_k": 0.5556,
      "precision_at_k": 0.065,
      "mrr": 0.4099,
      "hit_rate_at_k": 0.7,
      "latency_s": 0.1799,
      "peak_memory_mb": 695.7243
    },
    "generation": {
      "latency_s": null,
      "ttft_s": null,
      "tpot_ms": null,
      "input_tokens_count": null,
      "output_tokens_count": null,
      "peak_memory_mb": null
    },
    "overall": {
      "latency_s": 0.1824,
      "peak_memory_mb": 697.68
    }
  },
  "dense_upd_ret_no_rerank": {
    "git_commit": "b55a62f3b7e3f733a7e71d992e11e850956ea365",
    "query_count": 30,
    "retrieval": {
      "recall_at_k": 0.4639,
      "precision_at_k": 0.0533,
      "mrr": 0.3295,
      "hit_rate_at_k": 0.6333,
      "latency_s": 0.0884,
      "peak_memory_mb": 544.9107
    },
    "generation": {
      "latency_s": null,
      "ttft_s": null,
      "tpot_ms": null,
      "input_tokens_count": null,
      "output_tokens_count": null,
      "peak_memory_mb": null
    },
    "overall": {
      "latency_s": 0.0958,
      "peak_memory_mb": 545.91
    }
  },
  "sparse_upd_ret_no_rerank": {
    "git_commit": "b55a62f3b7e3f733a7e71d992e11e850956ea365",
    "query_count": 30,
    "retrieval": {
      "recall_at_k": 0.4972,
      "precision_at_k": 0.0583,
      "mrr": 0.4743,
      "hit_rate_at_k": 0.6333,
      "latency_s": 0.1107,
      "peak_memory_mb": 503.5913
    },
    "generation": {
      "latency_s": null,
      "ttft_s": null,
      "tpot_ms": null,
      "input_tokens_count": null,
      "output_tokens_count": null,
      "peak_memory_mb": null
    },
    "overall": {
      "latency_s": 0.1126,
      "peak_memory_mb": 504.6
    }
  },
  "dense_upd840_ret_no_rerank": {
    "git_commit": "ba4e83ae444158502de4b2c8e90722dfe996bbd2",
    "query_count": 30,
    "retrieval": {
      "recall_at_k": 0.45,
      "precision_at_k": 0.0533,
      "mrr": 0.3037,
      "hit_rate_at_k": 0.6,
      "latency_s": 0.1085,
      "peak_memory_mb": 550.4783
    },
    "generation": {
      "latency_s": null,
      "ttft_s": null,
      "tpot_ms": null,
      "input_tokens_count": null,
      "output_tokens_count": null,
      "peak_memory_mb": null
    },
    "overall": {
      "latency_s": 0.1177,
      "peak_memory_mb": 552.17
    }
  },
  "hybrid_upd840_ret_no_rerank": {
    "git_commit": "ba4e83ae444158502de4b2c8e90722dfe996bbd2",
    "query_count": 30,
    "retrieval": {
      "recall_at_k": 0.5667,
      "precision_at_k": 0.0667,
      "mrr": 0.3896,
      "hit_rate_at_k": 0.6667,
      "latency_s": 0.9748,
      "peak_memory_mb": 698.232
    },
    "generation": {
      "latency_s": null,
      "ttft_s": null,
      "tpot_ms": null,
      "input_tokens_count": null,
      "output_tokens_count": null,
      "peak_memory_mb": null
    },
    "overall": {
      "latency_s": 0.9931,
      "peak_memory_mb": 700.23
    }
  },
  "densen_chroma_ret_no_rerank": {
    "git_commit": "5af6f3db01de769be82781fc7a18f951ecb6a0b6",
    "query_count": 30,
    "retrieval": {
      "recall_at_k": 0.45,
      "precision_at_k": 0.0533,
      "mrr": 0.3037,
      "hit_rate_at_k": 0.6,
      "latency_s": 0.046,
      "peak_memory_mb": 576.341
    },
    "generation": {
      "latency_s": null,
      "ttft_s": null,
      "tpot_ms": null,
      "input_tokens_count": null,
      "output_tokens_count": null,
      "peak_memory_mb": null
    },
    "overall": {
      "latency_s": 0.0495,
      "peak_memory_mb": 577.25
    }
  },
  "dense_chroma_l2": {
    "query_count": 30,
    "retrieval": {
      "recall_at_k": 0.45,
      "precision_at_k": 0.0533,
      "mrr": 0.3037,
      "hit_rate_at_k": 0.6,
      "latency_s": 0.039,
      "peak_memory_mb": 578.634
    },
    "generation": {
      "latency_s": null,
      "ttft_s": null,
      "tpot_ms": null,
      "input_tokens_count": null,
      "output_tokens_count": null,
      "peak_memory_mb": null
    },
    "overall": {
      "latency_s": 0.0422,
      "peak_memory_mb": 579.5
    }
  },
  "dense_chroma_ip": {
    "query_count": 30,
    "retrieval": {
      "recall_at_k": 0.45,
      "precision_at_k": 0.0533,
      "mrr": 0.3037,
      "hit_rate_at_k": 0.6,
      "latency_s": 0.0217,
      "peak_memory_mb": 576.0443
    },
    "generation": {
      "latency_s": null,
      "ttft_s": null,
      "tpot_ms": null,
      "input_tokens_count": null,
      "output_tokens_count": null,
      "peak_memory_mb": null
    },
    "overall": {
      "latency_s": 0.0246,
      "peak_memory_mb": 576.98
    }
  },
  "dense_chunk512_overlap10%": {
    "query_count": 30,
    "retrieval": {
      "recall_at_k": 0.3,
      "precision_at_k": 0.0367,
      "mrr": 0.137,
      "hit_rate_at_k": 0.4,
      "latency_s": 0.0287,
      "peak_memory_mb": 571.83
    },
    "generation": {
      "latency_s": null,
      "ttft_s": null,
      "tpot_ms": null,
      "input_tokens_count": null,
      "output_tokens_count": null,
      "peak_memory_mb": null
    },
    "overall": {
      "latency_s": 0.0308,
      "peak_memory_mb": 573.38
    }
  },
  "dense_chunk512_overlap5%": {
    "query_count": 30,
    "retrieval": {
      "recall_at_k": 0.3,
      "precision_at_k": 0.0367,
      "mrr": 0.137,
      "hit_rate_at_k": 0.4,
      "latency_s": 0.0265,
      "peak_memory_mb": 568.9237
    },
    "generation": {
      "latency_s": null,
      "ttft_s": null,
      "tpot_ms": null,
      "input_tokens_count": null,
      "output_tokens_count": null,
      "peak_memory_mb": null
    },
    "overall": {
      "latency_s": 0.0294,
      "peak_memory_mb": 570.05
    }
  },
  "dense_chunk512_overlap20%": {
    "query_count": 30,
    "retrieval": {
      "recall_at_k": 0.3,
      "precision_at_k": 0.0367,
      "mrr": 0.137,
      "hit_rate_at_k": 0.4,
      "latency_s": 0.0203,
      "peak_memory_mb": 575.972
    },
    "generation": {
      "latency_s": null,
      "ttft_s": null,
      "tpot_ms": null,
      "input_tokens_count": null,
      "output_tokens_count": null,
      "peak_memory_mb": null
    },
    "overall": {
      "latency_s": 0.0226,
      "peak_memory_mb": 577.11
    }
  },
  "dense_512_20%_150q": {
    "query_count": 150,
    "retrieval": {
      "recall_at_k": null,
      "precision_at_k": null,
      "mrr": null,
      "hit_rate_at_k": null,
      "reference_text_coverage_at_k": 0.1533,
      "retrieved_text_relevance_at_k": 0.1378,
      "latency_s": 0.0148,
      "peak_memory_mb": 573.0146
    },
    "generation": {
      "latency_s": null,
      "ttft_s": null,
      "tpot_ms": null,
      "input_tokens_count": null,
      "output_tokens_count": null,
      "peak_memory_mb": null
    },
    "overall": {
      "latency_s": 0.0199,
      "peak_memory_mb": 573.96
    }
  },
  "dense_512_10%_150q": {
    "query_count": 150,
    "retrieval": {
      "recall_at_k": null,
      "precision_at_k": null,
      "mrr": null,
      "hit_rate_at_k": null,
      "reference_text_coverage_at_k": 0.5721,
      "retrieved_text_relevance_at_k": 0.024,
      "latency_s": 0.0222,
      "peak_memory_mb": 570.1871
    },
    "generation": {
      "latency_s": null,
      "ttft_s": null,
      "tpot_ms": null,
      "input_tokens_count": null,
      "output_tokens_count": null,
      "peak_memory_mb": null
    },
    "overall": {
      "latency_s": 0.0928,
      "peak_memory_mb": 572.86
    }
  },
  "dense_newclr_512_10%_": {
    "query_count": 1,
    "retrieval": {
      "recall_at_k": null,
      "precision_at_k": null,
      "mrr": null,
      "hit_rate_at_k": null,
      "reference_text_coverage_at_k": 0.1642,
      "retrieved_text_relevance_at_k": 0.1327,
      "latency_s": 0.099,
      "peak_memory_mb": 560.83
    },
    "generation": {
      "latency_s": null,
      "ttft_s": null,
      "tpot_ms": null,
      "input_tokens_count": null,
      "output_tokens_count": null,
      "peak_memory_mb": null
    },
    "overall": {
      "latency_s": 0.1059,
      "peak_memory_mb": 560.78
    }
  },
  "dense_newclr_512_5%_": {
    "query_count": 1,
    "retrieval": {
      "recall_at_k": null,
      "precision_at_k": null,
      "mrr": null,
      "hit_rate_at_k": null,
      "reference_text_coverage_at_k": 1.0,
      "retrieved_text_relevance_at_k": 0.0297,
      "latency_s": 0.1015,
      "peak_memory_mb": 564.19
    },
    "generation": {
      "latency_s": null,
      "ttft_s": null,
      "tpot_ms": null,
      "input_tokens_count": null,
      "output_tokens_count": null,
      "peak_memory_mb": null
    },
    "overall": {
      "latency_s": 0.1043,
      "peak_memory_mb": 564.19
    }
  }
}

logs.md

# 19/10/26

- very low precision(0.07), though good recall(0.4667)
   - ### Workflow

### Retrieval

- *hit rate of 0.60* : 60% of queries retrieved at least one relevant chunk within the evaluation cutoff
   - *Recall of 0.4194* : many labeled relevant chunks were not retrieved.
   - *Precision@10* : approximately one in ten retrieved chunks were relevant on average

### Generation

- faithfulness = 0.0
   - answer completeness = 0.0
   - hallucination rate = 0.9333

### 1. Dense

- recall_at_k             :  0.2417 -> 0.4639
- precision_at_k       : 0.03      -> 0.0533
- mrr                          :  0.3006 -> 0.3295
- hit_rate_at_k           :  0.4333  -> 0.6333
- latency_s                 :  0.0145  -> 0.0884
- peak_memory_mb :  546.375  -> 544.9107

### 2. Hybrid

- recall_at_k             :  0.4694 -> 0.5556
- precision_at_k       :  0.055   -> 0.065
- mrr                          :  0.4128 -> 0.4099
- hit_rate_at_k          :   0.6333  -> 0.7
- latency_s                 :  0.1205   -> 0.1799
- peak_memory_mb :  695.02   ->  695.7243

### 3. Sparse

- recall_at_k             :  0.4972 -> 0.4972
- precision_at_k       :  0.0583 -> 0.0583
- mrr                          :  0.4743  -> 0.4743
- hit_rate_at_k           :  0.6333  -> 0.6333
- latency_s                  :  0.1056  -> 0.1107
- peak_memory_mb :  503.521 ->  503.5913

### a. Dense

- recall_at_k             :  0.2417 -> 0.4639  ->  .45
- precision_at_k       :  0.03      -> 0.0533  ->  0.0533
- mrr                          :  0.3006 -> 0.3295  ->  0.3037
- hit_rate_at_k           :  0.4333  -> 0.6333  ->  0.6
- latency_s                 :  0.0145  -> 0.0884  ->  0.1085
- peak_memory_mb :  546.375  -> 544.9107  ->  550.4783

### b. Hybrid

- recall_at_k             :  0.4694 -> 0.5556  ->  0.5667
- precision_at_k       :  0.055   -> 0.065  ->  0.0667
- mrr                          :  0.4128 -> 0.4099  ->  0.3896
- hit_rate_at_k          :   0.6333  -> 0.7  ->  0.6667
- latency_s                 :  0.1205   -> 0.1799  ->  0.9748
- peak_memory_mb :  695.02   ->  695.7243  ->  698.232